Enlace,Titulo,Hashtags,Otros,Texto
https://youtu.be/-ppWHdwF-9g,Cómo hacer una app rápida,#app #appsheet,,"La App más rápida.

Crea una hoja de cálculo de Google
Rellena los títulos de las columnas, y si quieres algunos datos
En extensiones puedes elegir crear una aplicación.
Será una aplicación donde puedas consultar editar y añadir registros
Tendrás que elegir una clave única en las columnas para lo cual en este caso, tengo que poner grupo y disco ya que un grupo puede tener mas de un disco, y señalo también que la portada es tipo imagen.
Pues ya la tienes solo te queda poner los usuarios que pueden usarlo y enviar el enlace.
Así se vería el enlace y podrías, por ejemplo, tomar una foto de la portada para editar el disco.
Así se vería en el móvil y se puede hacer una foto de la portada.
Puedes también compartir al público en general, Ten cuidado que en este caso cualquiera puede consultar e incluso borrar los datos.

En un próximo video veremos un ejemplo de 2 tablas relacionadas, indicando las canciones que componen cada disco."
https://youtu.be/lIMPNVwIfDY,Cómo hacer una app rápida con app sheet segunda parte,#appsheet,,"Vamos ahora a complicarlo un poco
vamos a poner las canciones que tiene cada disco.
Creamos una hoja nueva en la hoja de cálculo.

Editamos nuestra APP y vemos que nos ofrece añadir una nueva tabla con la hoja que hemos creado.

La añadimos y vemos las columnas.
Ha señalado que la columna disco es una referencia a la clave de la otra tabla. esto lo ha hecho por inteligencia artificial.

Ahora en nuestra APP cuando consultamos un disco nos lista debajo las canciones que tiene.

Yo quiero además que pueda consultar las canciones sueltas.
Voy a UX que es interfaz de usuario y creo una nueva vista principal que voy a llamar canciones para los datos de esa hoja.
Con esto ha aparecido otro botón en la APP, para consultar las canciones.
ya está.
Cuando consultas un disco te dice las canciones que tiene, y cuando consultas una canción te dice en que disco está.
Podrás añadir canciones a los discos, y añadir discos.
Editar, incluso puedes poner un enlace al video de la canción."
https://youtu.be/A7Nye_aNMQY,Comprobación de disponibilidad ofertas publicadas,#oficinasae,,"hola os voy a explicar cómo hago ya un
listado de comprobación para llamar por
teléfono a la gente que se apuntan a las
puertas públicas yo utilizo dos
programas que vienen de con windows
desde siempre uno que recortes lo podéis
buscar aquí en herramientas
de windows
herramientas recortes y utilizo otro
también de siempre que es paint lo que
hago es que las dos aplicaciones está la
tengo anclada a la barra de tareas
eso se hace arrastrando
el icono hacia aquí te dirán que si lo
quiere anclar a mí no me deja porque ya
está ya está anclado vale tanto uno como
otro bueno qué es lo que hago pues como
no se puede sacar un pantallazo donde
aparezca el teléfono y el nombre porque
no cabe en la misma pantalla yo lo que
hago es que cree corto
para evitar problemas de protección de
datos
he quitado del dni los apellidos pero
imaginar esto vale corto y corto del dni
el orden error de entre calculado esa
primera columna
esto una vez que los recortes se quedan
en el portal pero me voy al paint y le
digo pegar
y ahora vuelvo otra vez a la pantalla
está me voy a la parte del teléfono
imaginaros otra vez
qué es esta parte de aquí tampoco lo
querido poner los temas de
de protección de datos
[Música]
y pego corto
[Música]
y ve otra vez
en el país
y ahora por la flechita del cursor
lo pongo al lado
donde coincidan
y este archivo ya lo guardo y además lo
empleó porque va a seguir para para
llamar por teléfono perdona que no se
vea claramente lo que yo consigo porque
no quiero que esto se quede grabado con
datos de personas vale
bueno nada más un saludo
"
https://youtu.be/7G68NmZYkrM,Cómo se registra una oferta del Pfea de puestos no cualificados.,#oficinasae,,"Veamos cómo se registra una oferta del PFEA de  puestos no cualificados, lo primero es entrar  
en alta de ofertas en esta primera pantalla  rellenamos el dato de programa especial con  
emparejamiento sin ocupación, nos pide duración  del contrato que suelen ser de 12 a 15 días   
hay que poner desempleados con la disponibilidad 0008  ámbito territorial municipio o pedanía si así lo  
pidiesen y un candidato por puesto. En la pestaña  de servicios tenemos que poner en servicios  
recibidos un check de ausencia del servicio 440  desde la fecha de hace un año hasta la fecha  
de hoy en servicios en curso sólo el check de  ausencia del servicio 440, rellenamos los datos de  
programa especial y con esto ya hemos terminado  de registrar la oferta, ¡espero que te sea útil!
"
https://youtu.be/iPc_bj5k-d4,Búsqueda parametrizada en Hermes,#oficinasae,,"búsqueda parametrizada en Hermes en este  caso voy a hacer una búsqueda de ejemplo  
entramos en demanda y dentro de  esto en búsqueda parametrizada
hacemos clic sobre mantenimiento y después  en nuevo ponemos un nombre y aceptamos
luego seleccionamos que filtro queremos poner en  
este caso ámbito territorial le damos  a filtros y rellenamos Castilblanco
volvemos a la parte izquierda y seleccionamos esta  
vez colectivo especial le damos a filtro  y rellenamos servicios previos al empleo
vamos a poner otro filtro, nos vamos  a disponibilidad específica y ponemos  
filtro y rellenamos código de disponibilidad  0008 como hemos puesto este último filtro como  
""O"" le estamos diciendo al ordenador que  queremos saber los demandantes que hay en  
Castilblanco que o bien son demandante  de servicios previos al empleo o bien  
del colectivo 0008 o bien las dos cosas a  la vez si os fijáis la línea 1 está más a  
la izquierda que las otras eso quiere decir que  esa condición se tiene que cumplir y la línea 2  
y la 3 están al mismo nivel eso es porque vale  con que se cumpla una de las dos condiciones
"